{
  "name": "kubernetes",
  "version": "1.0.0",
  "description": "Kubernetes CLI tools, aliases, and shell helpers",
  "dependencies": ["containers"],
  "sections": {
    "kubernetes.core": "Base kubectl aliases and functions",
    "kubernetes.helm": "Helm package manager aliases",
    "kubernetes.ctx": "Context and namespace switching helpers"
  },
  "shell": {
    "load_order": ["aliases.sh", "completions.sh"]
  },
  "install": {
    "macos": {
      "brew": ["kubectl", "helm", "kubectx"]
    },
    "linux": {
      "apt": ["kubectl"],
      "snap": ["helm --classic", "kubectl --classic"]
    },
    "wsl": { "inherit": "linux" }
  }
}
